{
  "protocolVersion": 1,
  "length": 256,
  "sequence": 101,
  "sessionId": "session-001",
  "productId": "A",
  "gameReleaseId": "A-1.1.0",
  "messageType": "Delta",
  "reliability": "Reliable",
  "integrity": {
    "algorithm": "SHA256",
    "value": "aaaaaaaaaaaaaaaaaaaaaaaaaaaaaaaaaaaaaaaaaaaaaaaaaaaaaaaaaaaaaaaa"
  },
  "traceId": "trace-delta-101",
  "transportPolicy": {
    "maxMessageBytes": 65536,
    "maxFragmentBytes": 4096,
    "antiReplayWindow": 1024,
    "authBinding": "SessionAdmission",
    "errorClass": "Rejectable"
  },
  "body": {
    "baseSnapshotId": "snapshot-100",
    "fromRevision": 12,
    "toRevision": 13,
    "mappingSetHash": "aaaaaaaaaaaaaaaaaaaaaaaaaaaaaaaaaaaaaaaaaaaaaaaaaaaaaaaaaaaaaaaa",
    "confirmationSequence": 7,
    "tombstones": [
      {
        "netEntityId": "00000000000000010000000000000001",
        "untilRevision": 48
      }
    ]
  }
}
