{
  "protocolVersion": 1,
  "length": 256,
  "sequence": 106,
  "sessionId": "session-001",
  "productId": "A",
  "gameReleaseId": "A-1.1.0",
  "messageType": "MaintenanceKick",
  "reliability": "Reliable",
  "integrity": {
    "algorithm": "SHA256",
    "value": "aaaaaaaaaaaaaaaaaaaaaaaaaaaaaaaaaaaaaaaaaaaaaaaaaaaaaaaaaaaaaaaa"
  },
  "traceId": "trace-maintenancekick-106",
  "transportPolicy": {
    "maxMessageBytes": 65536,
    "maxFragmentBytes": 4096,
    "antiReplayWindow": 1024,
    "authBinding": "SessionAdmission",
    "errorClass": "Rejectable"
  },
  "body": {
    "reasonCode": "MaintenanceKick"
  }
}
